key,en,th
DIALOGE_V3_3_2,I'm sure the locals will love it.,รับรองว่าชาวบ้านต้องชอบแน่ๆ ครับ
DIALOGE_V3_3_3,"Thanks a lot for coming to help! Here... a full gallon of gas, just as promised.",ขอบใจเอ็งมากที่มาช่วย! เอ้า... นี่น้ำมันเต็มแกลลอนตามที่สัญญาไว้
DIALOGE_V3_3_4,"Thanks, Chef! Now I have the fuel. My car is ready to tackle the mountaintop!",ขอบคุณครับเชฟ! ได้น้ำมันแล้ว รถผมพร้อมลุยขึ้นยอดเขาต่อเลย
DIALOGE_V3_3_5,"Have a safe journey! Good luck, young man!",เดินทางปลอดภัยล่ะ! โชคดีนะไอ้หนุ่ม!
COOKING_POT_DESERT_COOKING,Cooking desert,กำลังทำของหวาน
ON_INTERACTION_COOK_DESERT,Press E to make desert,กด E เพื่อทำของหวาน
DIALOGE_V3_4_1,That smells so good! Is there some kind of party going on around here?,กลิ่นหอมจังเลยครับพี่ แถวนี้เขามีงานเลี้ยงอะไรกันเหรอ?
DIALOGE_V3_4_2,Food is our soul!,อาหารคือจิตวิญญาณของพวกเรา!
DIALOGE_V3_4_3,Come on... eating this stew will give you the energy to drive your car through the mountaintop!,มาสิ... กินสตูว์หม้อนี้รับรองมีแรงขับรถพุ่งทะลุยอดเขาแน่!
DIALOGE_V3_5_1,"Wow, the cabbage plants in this village are huge!",ผักกาดหมู่บ้านนี้ต้นใหญ่จังเลยนะครับพี่!
DIALOGE_V3_5_2,certain!,แน่นอน!
DIALOGE_V3_5_3,The soil here is good because we all help to make our own fertilizer.,ดินที่นี่ดีเพราะพวกเราช่วยกันหมักปุ๋ยเอง
DIALOGE_V3_5_4,"Want to grab a fresh vegetable to eat on the train, young man?",สนใจเอาผักสดๆ ไปกินบนรถสักหัวไหมไอ้หนุ่ม?
DIALOGE_V3_5_5,"No, thank you. I have a long drive ahead of me, and I'm afraid it might spoil before I get there.",ไม่เอาดีกว่าครับ พอดีผมต้องขับรถอีกไกล กลัวมันจะเน่าเสียก่อน
DIALOGE_V3_6_1,"Hey brother! You drove a long way, didn't you? How are you? Any back or waist pain?",ไงพี่ชาย! ขับรถมาไกลล่ะสิ เป็นไงบ้าง ปวดหลังปวดเอวไหม?
DIALOGE_V3_6_2,So what are you busy doing right now?,แล้วตอนนี้กำลังยุ่งทำอะไรอยู่ล่ะนั่น?
DIALOGE_V3_6_3,"Things are going alright, sir. Right now I'm exploring the village and stocking up on supplies for the rest of the journey.",ก็เรื่อยๆ ครับพี่ ตอนนี้กำลังเดินสำรวจหมู่บ้านหาของไปตุนไว้เดินทางต่อครับ
DIALOGE_V3_6_4,Great! Your health always comes first.,ดีเลย! ร่างกายต้องมาก่อนเสมอ
DIALOGE_V3_6_5,"Don't forget to eat well and make time to stretch! Come on... keep going, brother! If you're tired, you can always join us for yoga!",อย่าลืมกินอาหารดีๆ แล้วหาเวลายืดเส้นยืดสายบ้างล่ะ เอ้า... สู้ๆ นะพี่ชาย! เหนื่อยก็มาเล่นโยคะกับพวกเราได้เสมอ!
DIALOGE_V3_7_1,"Hello, sir! The vegetables and fruits in this village look so fresh and delicious!",สวัสดีครับพี่! ผักผลไม้หมู่บ้านนี้ดูสดน่ากินมากเลย
DIALOGE_V3_7_2,"Of course! Grown with natural compost... By the way, are you going to the mountaintop? Can I hitch a ride with you?",แน่นอน! ปลูกด้วยปุ๋ยหมักธรรมชาติจ้ะ... ว่าแต่จะไปยอดเขาใช่ไหม? ขอติดรถไปด้วยคนสิ!
DIALOGE_V3_7_3,"Okay, sir! But what are you going to do up there?",ได้ครับพี่! แต่จะขึ้นไปทำอะไรบนนั้นเหรอ?
DIALOGE_V3_7_4,I'm going in search of some mysterious ultimate ingredient. I'll take care of the supplies and make sure you have plenty of stretches to relieve your back pain along the way!,จะไปตามหาสุดยอดวัตถุดิบลึกลับน่ะ เดี๋ยวรับหน้าที่ดูแลเสบียงและพายืดเส้นยืดสายแก้ปวดหลังให้ตลอดทางเอง!
DIALOGE_V3_7_5,"Awesome! Jump in the back of the truck, man!",แจ๋วเลยครับ! กระโดดขึ้นท้ายกระบะมาเลยพี่!
QUEST_STARTED_LEVEL_5,Br$&#^ewing#^(& poti@%*ons for h^&(unter&))s,%^&*@!*%#(%*!@% ปรุ%$งยาให้^@&กับนัก$%*%!ล่า
ON_INTERACTION_COLLECT_FLOWER,Press E to collect flower,กด E เพื่อเก็บดอกไม้
ON_INTERACTION_SUBMIT_QUEST_LEVEL_4,Press E to add flower,กด E เพื่อใส่ดอกไม้
DIALOGE_V4_1_1,"Flower...","ดอกไม้..."
DIALOGE_V4_1_2,"That hunter only comes out when it's dark...","เจ้านักล่านั่นมันจะออกมาตอนฟ้ามืดเท่านั้น..."
DIALOGE_V4_1_3,You need to have your masterpiece ready.,ต้องเตรียมผลงานชิ้นเอกให้พร้อม
DIALOGE_V4_2_1,Hey! You!,เฮ้ย! เอ็งน่ะ
DIALOGE_V4_2_2,"Go brew some ""Returning Potion"" for me!",ไปปรุง ยาวนกลับ มาให้ข้าที
DIALOGE_V4_2_3,"Every time I throw a boomerang, it flies off into the forest and never comes back to me!",ขว้างบูมเมอแรงทีไร ปลิวหายเข้าป่าไม่เคยกลับมาหาข้าเลย!
DIALOGE_V4_2_4,"Okay, sir. Wait a moment, I'll go brew it for you.",ได้ครับพี่ รอเดี๋ยวผมไปปรุงมาให้
DIALOGE_V4_3_1,My spear has missed its target ten times already!,หอกข้ามันแทงพลาดเป้ามาสิบหนแล้ว!
DIALOGE_V4_3_2,"Hurry up and brew some ""Pineapple Eye Potion"" for me to drink right now!",เอ็งรีบไปปรุง  ยาตาสับปะรด มาให้ข้าซดเดี๋ยวนี้!
DIALOGE_V4_3_3,Pineapple Eye Potion?,ยาตาสับปะรด?
DIALOGE_V4_3_4,"Sure thing, sir!",จัดไปครับพี่
DIALOGE_V4_4_1,My axe is too heavy!,ขวานข้ามันหนักเกินไป
DIALOGE_V4_4_2,My back hurts every time I lift it!,ยกทีไรปวดหลังทุกที!
DIALOGE_V4_4_3,"Go find me some ""Lightweight Potion""!",ไปหา 'ยาตัวเบาหวิว' มาให้ข้าหน่อย
DIALOGE_V4_4_4,I'll swing my axe like a whirlwind!,ข้าจะควงขวานเป็นพายุเลย!
DIALOGE_V4_4_5,"Be careful, sir, you might get blown away with both you and your axe... I'll go brew it for you.",ระวังควงแล้วปลิวไปทั้งคนทั้งขวานนะครับพี่... เดี๋ยวผมไปปรุงให้
